{
  "schemaVersion": 1,
  "reviewId": "REV-0004",
  "specId": "SPEC-0002",
  "sessionId": "ASES-0001",
  "reviewerSessionId": null,
  "reviewType": "code-review",
  "reviewerRole": "QA_REVIEWER",
  "actorType": "human",
  "actorId": "qualified-human-code-reviewer",
  "decision": "APPROVE",
  "satisfiesHumanGate": true,
  "findings": [],
  "notes": [
    "D9. Human code review of the Phase B3 control-plane implementation. Recorded verbatim from the reviewer's decision; no findings were stated and none are invented here.",
    "Reviewer's stated scope: SDD CLI agent commands, agent preflight, agent session creation, task-scope enforcement, repository-state and digest attribution, repository drift detection, verification records, review records, approval separation, role enforcement, git subprocess invocation, git reference validation, path normalisation, path traversal protections, symlink handling, agent validation rules, JSON schemas, and the B3 automated tests.",
    "The reviewer stated the review was conducted as human engineering work rather than relying solely on AI-generated review evidence, and that no issue requires blocking Phase B3 governance closure.",
    "Anchored to ASES-0001 because the reviewed code spans all three implementation sessions: ASES-0001 (TASK-007 onward), ASES-0002 (TASK-011) and ASES-0003 (TASK-012).",
    "This is a human code-review decision only. It is not architecture approval, security risk acceptance, production approval, or final convergence acceptance.",
    "Date recorded as 2026-09-08, the date the decision was received. The decision text left the date field as a placeholder, so the receipt date is used and labelled as such."
  ]
}
