{
  "schemaVersion": 1,
  "reviewId": "REV-0008",
  "specId": "SPEC-0002",
  "sessionId": "ASES-0007",
  "reviewerSessionId": null,
  "reviewType": "code-review",
  "reviewerRole": "QA_REVIEWER",
  "actorType": "ai",
  "actorId": "b3-independent-reviewer",
  "decision": "APPROVE",
  "satisfiesHumanGate": false,
  "findings": [
    {
      "severity": "OBSERVATION",
      "summary": "The corrected test asserts the invariant rather than a value, and checks strictly more than the original: the live document round-trip plus all three permitted verdicts. A return of prefix matching would still fail it.",
      "artifact": "tools/sdd/tests/validator.test.mjs",
      "reference": "CONV-013"
    },
    {
      "severity": "OBSERVATION",
      "summary": "Scope discipline held. The parser was a prohibited path, so the session could not make the test pass by editing the code under test.",
      "artifact": "specs/SPEC-0002-agent-integration-controlled-execution/execution/ASES-0007.json",
      "reference": "TASK-016"
    }
  ],
  "notes": [
    "APPROVE. No assertion was relaxed; the test is stronger than the one it replaces.",
    "Reviewed under an actor distinct from the implementing session b3-brittle-test-fix and the tester, per SDD-V051.",
    "This is an AI review and satisfies no human gate."
  ]
}
