{
  "schemaVersion": 1,
  "reviewId": "REV-0006",
  "specId": "SPEC-0002",
  "sessionId": "ASES-0005",
  "reviewerSessionId": null,
  "reviewType": "code-review",
  "reviewerRole": "QA_REVIEWER",
  "actorType": "ai",
  "actorId": "b3-independent-reviewer",
  "decision": "APPROVE",
  "satisfiesHumanGate": false,
  "findings": [
    {
      "severity": "OBSERVATION",
      "summary": "Exact matching replaces prefix matching. A declaration is now recognised only in the metadata table cell or at the start of a line, so prose mentioning a verdict cannot become one.",
      "artifact": "tools/sdd/lib/traceability.mjs",
      "reference": "TASK-014"
    },
    {
      "severity": "OBSERVATION",
      "summary": "Ambiguity is surfaced rather than resolved. Two different declarations return AMBIGUOUS, which is deliberately not a permitted verdict, so the existing enum check rejects it without a new rule.",
      "artifact": "tools/sdd/lib/traceability.mjs",
      "reference": "UT-025"
    },
    {
      "severity": "MINOR",
      "summary": "Scope attribution is weak for untracked directories: git collapses tools/ to one entry, so file-level changes there are unattributable rather than scope-checked. Reported honestly by the tool, and a real limitation of governing an uncommitted tree.",
      "artifact": "tools/sdd/lib/agent.mjs",
      "reference": "CONV-009"
    }
  ],
  "notes": [
    "APPROVE. The convergence standard was not weakened: the permitted verdict set is unchanged and the parser is now stricter than before.",
    "Reviewed under an actor distinct from the implementing session b3-parser-fix and the tester, per SDD-V051.",
    "This is an AI review and satisfies no human gate."
  ]
}
