{
  "schemaVersion": 1,
  "reviewId": "REV-0005",
  "specId": "SPEC-0002",
  "sessionId": "ASES-0004",
  "reviewerSessionId": null,
  "reviewType": "security-review",
  "reviewerRole": "SECURITY_REVIEWER",
  "actorType": "ai",
  "actorId": "b3-independent-reviewer",
  "decision": "APPROVE",
  "satisfiesHumanGate": false,
  "findings": [
    {
      "severity": "OBSERVATION",
      "summary": "The workflow change is one added step. Every D6 constraint holds against executable content: no deploy, no production or staging access, no secret, no database, no migration, permissions contents:read, SDD-V041 not promoted.",
      "artifact": ".github/workflows/sdd-validate.yml",
      "reference": "CONV-005"
    },
    {
      "severity": "MINOR",
      "summary": "A scope deviation occurred: docs/EVIDENCE_CONFLICTS.md changed while ASES-0004 was open, from concurrent D2 governance work. Correctly reported by the scope checker as SDD-V046, recorded in VER-0004, and not absorbed by widening TASK-013.",
      "artifact": "docs/EVIDENCE_CONFLICTS.md",
      "reference": "TASK-013"
    },
    {
      "severity": "OBSERVATION",
      "summary": "GitHub-hosted execution remains UNKNOWN. The workflow has never run remotely and no claim to the contrary is made anywhere in the evidence.",
      "artifact": ".github/workflows/sdd-validate.yml",
      "reference": "CONV-005"
    }
  ],
  "notes": [
    "APPROVE for the remediation as scoped. The CI trust boundary is unchanged: the workflow is read-only, needs no credential, and cannot reach any deployed environment.",
    "Reviewed under an actor distinct from the implementing session b3-ci-remediation and the tester b3-remediation-tester, per SDD-V051.",
    "This is an AI review. It satisfies no human gate. The authorising DevOps decision is D6 and is recorded separately."
  ]
}
