{
  "schemaVersion": 1,
  "reviewId": "REV-0002",
  "specId": "SPEC-0003",
  "sessionId": "ASES-0001",
  "reviewerSessionId": null,
  "reviewType": "code-review",
  "reviewerRole": "QA_REVIEWER",
  "actorType": "human",
  "actorId": "qualified-human-code-reviewer",
  "decision": "APPROVE",
  "satisfiesHumanGate": true,
  "findings": [
    {
      "severity": "OBSERVATION",
      "summary": "Reviewed the final SPEC-0003 product diff covering apps/web/src/components/workspace/TableSearch.tsx and apps/web/tests/e2e/tablesearch-a11y.spec.ts against the relevant requirements, acceptance criteria, Playwright evidence, scope evidence and the documented security and accessibility limitations. No issue in the reviewed two-file diff requires blocking convergence.",
      "artifact": "apps/web/src/components/workspace/TableSearch.tsx",
      "reference": "CONV-007"
    }
  ],
  "notes": [
    "Human code review for the R2 gate, which docs/sdd/RISK_TO_PROCESS_MATRIX.md requires as 1 reviewer. Decision APPROVE, recorded 2026-09-08.",
    "Made by a qualified human code reviewer and explicitly not by the AI implementation agent. REV-0001 remains the separate AI review and still carries satisfiesHumanGate false; it is not superseded or rewritten.",
    "Scope of this decision, as stated by the reviewer: a human code-review decision only. It is not staging approval, not production approval, not final convergence acceptance, and not acceptance of unrelated repository findings."
  ]
}
